{
  "schema_version": "1.0",
  "scope": "protocol",
  "subject_id": "project-handoff",
  "version": "0.1.0",
  "source_commit": "30b0b6f",
  "source_date": "2026-08-08T08:17:42+01:00",
  "toolchain": {
    "node": "v25.2.1",
    "builder": "verify-all@0.1.0"
  },
  "checks": [
    {
      "name": "manifest",
      "passed": true,
      "summary": "22 files hashed"
    },
    {
      "name": "validate",
      "passed": true,
      "summary": "schema + kernel invariants ok"
    },
    {
      "name": "tests",
      "passed": true,
      "summary": "10/10 cases",
      "counts": {
        "total": 10,
        "passed": 10,
        "failed": 0
      }
    },
    {
      "name": "evals",
      "passed": true,
      "summary": "eval designs valid, ceiling respected"
    },
    {
      "name": "hostile",
      "passed": true,
      "summary": "clean"
    }
  ],
  "files_sha256": [
    {
      "path": "CHANGELOG.md",
      "sha256": "505defa15e40dabb693ef3e390dfe137fc7bce7bb73629cacfd1989d75bacdb1"
    },
    {
      "path": "LICENSE",
      "sha256": "6335e965a6b689578ef518d8b3bbdd848c9ee052fc2df901a979bce17f614925"
    },
    {
      "path": "README.md",
      "sha256": "0af39008494280771cc3b37391404863f0530af7b8566b4515740559062c81a6"
    },
    {
      "path": "SECURITY.md",
      "sha256": "f129f9ad175c2e191b6dc51f70429745fd3404d428f7fcd93d87eb54d1a4e709"
    },
    {
      "path": "SKILL.md",
      "sha256": "0257b24082203c5357b51bb21c069772f176f7ad1af31ebeaa3aef6375f4e9b4"
    },
    {
      "path": "adapters/claude/README.md",
      "sha256": "e24720408ae2d9dda34e45be81db4c0adca146718a67853e8750dc807a1ba6dd"
    },
    {
      "path": "adapters/codex/README.md",
      "sha256": "3ff9c415a454498ea86ee763dd812c513850efb75bc1f411043bcac7d0fe6271"
    },
    {
      "path": "adapters/generic-chat/prompt.md",
      "sha256": "ccb8bade9e3e66e214e850eb59350b1cf19a462ff841f903e43beb9e26f2e934"
    },
    {
      "path": "adapters/local-agent/README.md",
      "sha256": "59998e24625e53315825679f6a7e14ec85fe4954aae9f66370edd78de8b9eaa3"
    },
    {
      "path": "assets/handoff-template.md",
      "sha256": "4111acfdbdaabda367c448148480a819451d8e4819fcc0672b7ca705a8f36688"
    },
    {
      "path": "assets/receipt-template.json",
      "sha256": "f87639cc0cf3109384e11f14e203f2cba5c8a5dfcacb05e11b867279d8ff49f7"
    },
    {
      "path": "evals/README.md",
      "sha256": "aa4159b9286194f96f0fdb31f078b1de8b19048393ba2a3593f11897a931ae96"
    },
    {
      "path": "evals/result.template.json",
      "sha256": "cf2b7399a8b6a587893886df00494b13904575221f58507ec5ef65e0d8ec59a5"
    },
    {
      "path": "evals/task-set.json",
      "sha256": "30d686cd4640921375d3e7063316da6eb09b8348ba63453f1ca844cde779c4c4"
    },
    {
      "path": "examples/handoff-input.md",
      "sha256": "0deefaccca62c2be715baa50ff05a21bb0afe28fb5969f7520a8be65c3e6ab09"
    },
    {
      "path": "examples/handoff-output.md",
      "sha256": "137650f4b22fe669727d92746529ff375c76245cc1deeed3492903226f40e141"
    },
    {
      "path": "examples/receipt.json",
      "sha256": "f2ff9af2e8cd729209fb28c24d2100a4d283362d15ae42c9d3bdd3a026685244"
    },
    {
      "path": "protocol.yaml",
      "sha256": "4c84a30f72b295822fef8542b86668f976529510bad5635a5857e9e9107f56ab"
    },
    {
      "path": "references/handoff-checklist.md",
      "sha256": "7ed612934ca039676108b07c0566a0f9b373f8d68b6d4a0f3e1d2842fe9851c1"
    },
    {
      "path": "tests/cases.json",
      "sha256": "f8ab54fe8303a83b79a3d9c354fcaae0a53e26bbac003fd16678bfb65ca14b51"
    },
    {
      "path": "tests/fixtures/bad-output.md",
      "sha256": "7df65f2af9b7ecb5fc5b1cdf1538a9a5d111d84881e497926a030663ffcbda7b"
    },
    {
      "path": "tests/fixtures/bad-receipt.json",
      "sha256": "0eb8a1022297b8de075a2db53860e4649f068c698ca3e469b21d93ca9285d9f9"
    }
  ],
  "assurance_status": "EXAMPLE_CONFORMANCE_VALIDATED",
  "productivity_evidence": "NO_IMPACT_EVIDENCE",
  "replay": {
    "command": "node tools/verify-all.js",
    "byte_identical_expected": true
  }
}
