{
  "schema_version": "1.0",
  "scope": "repository",
  "subject_id": "productivity-protocols",
  "version": "0.1.0",
  "source_commit": "f2051eb",
  "source_date": "2026-08-08T08:39:52+01:00",
  "toolchain": {
    "node": "v25.2.1",
    "builder": "verify-all@0.1.0"
  },
  "checks": [
    {
      "name": "manifest",
      "passed": true,
      "summary": "8/8 packs"
    },
    {
      "name": "validate",
      "passed": true,
      "summary": "8/8 packs"
    },
    {
      "name": "tests",
      "passed": true,
      "summary": "8/8 packs"
    },
    {
      "name": "evals",
      "passed": true,
      "summary": "8/8 packs"
    },
    {
      "name": "hostile",
      "passed": true,
      "summary": "8/8 packs"
    }
  ],
  "files_sha256": [
    {
      "path": "protocols/adversarial-output-review/RECEIPT.json",
      "sha256": "8e3f7ed563c3daf602b7347f3cf4f1b61cc3be15250baddb9212fd880a71c210"
    },
    {
      "path": "protocols/decision-memo-under-uncertainty/RECEIPT.json",
      "sha256": "ba1ea92c7323dd63102e3a758abe3cd03aa2b8b9ebd7d5ced477c5b40177df55"
    },
    {
      "path": "protocols/document-to-action-plan/RECEIPT.json",
      "sha256": "a44030c32f4753a9144068908cfaf24765bcf6a4e9af10b84d8ae86cfed3c4fd"
    },
    {
      "path": "protocols/evidence-backed-brief/RECEIPT.json",
      "sha256": "4185f16654b286a1169607d9a669b1212ef8e2b30ed09ae75df5398a48bcb39a"
    },
    {
      "path": "protocols/goal-to-verified-deliverable/RECEIPT.json",
      "sha256": "a22417170a3c832b8b4a9ff89dc5446693908f1ca9d0bb9cbc6134f0ab1cb2cb"
    },
    {
      "path": "protocols/project-handoff/RECEIPT.json",
      "sha256": "c3d1169aa4d68b2165b7ef3868802e65ce60f64a17b5bdb7fcc3167c639708e0"
    },
    {
      "path": "protocols/repetitive-workflow-capture/RECEIPT.json",
      "sha256": "9b7297ef88aed5728c42349d75526b349668d1c63baa86ddf742c9dfadf772e2"
    },
    {
      "path": "protocols/spreadsheet-quality-audit/RECEIPT.json",
      "sha256": "a2918c27473c745fcb2be83c5a31c6c2bd98c51f6f2321a70d0d1b40f9ef5555"
    }
  ],
  "assurance_status": "EXAMPLE_CONFORMANCE_VALIDATED",
  "productivity_evidence": "NO_IMPACT_EVIDENCE",
  "replay": {
    "command": "node tools/verify-all.js",
    "byte_identical_expected": true
  }
}
